{
  "id": "float-fmul",
  "name": "FMUL: F0 = F1 * F2",
  "category": "float",
  "description": "Float multiplication",
  "bytecode_hex": "4200010280",
  "expected": {
    "final_state": "HALTED",
    "gp": {},
    "fp": {
      "0": 10.0
    }
  },
  "preconditions": {
    "fp": {
      "0": 0.0,
      "1": 2.5,
      "2": 4.0
    }
  },
  "tags": [
    "smoke",
    "p0"
  ]
}