{
  "id": "float-fmin",
  "name": "FMIN: F0 = min(F1, F2)",
  "category": "float",
  "description": "FMIN Format C: min(F[fs1], F[fd]) stored in F[fd]. With F0=7.0, F1=3.0: min(3.0, 7.0) = 3.0",
  "bytecode_hex": "46000180",
  "expected": {
    "final_state": "HALTED",
    "gp": {},
    "fp": {
      "0": 3.0
    }
  },
  "preconditions": {
    "fp": {
      "0": 7.0,
      "1": 3.0
    }
  }
}